{
    "contact_info": {
        "name": "Merlin the Turqouise",
        "email": "merlin.t.turqouise@fakemail.com",
        "phone": "(666) 666-6174",
        "location": "Whimsyville, CA",
        "linkedin": "linkedin.com/in/merlin-t-turquise-wizard",
        "website": null,
        "github": "github.com/merlins-big-book-of-spells"
    },
    "professional_summary": {
        "title": "Professional Summary",
        "content": "Senior Data Wizard with 100+ years of wizarding experience building magical data infrastructure at unicorn startups and dragon healthcare companies. Strong background in cross-dimensional collaboration, translating complex spell-casting insights into potion decisions and building foundational crystal ball infrastructure. Proven track record of delivering measurable enchantment impact: millions of gold coins in operational cost saved, 600M+ magical creatures catalogued, 15% improvement in fortune-telling accuracy.",
        "tagline": "Seeking senior-level opportunities in AI/ML sorcery and mystical product analytics",
        "highlights": [
            "100+ years of wizarding experience",
            "millions of gold coins in operational cost saved",
            "600M+ magical creatures catalogued",
            "15% improvement in fortune-telling accuracy"
        ]
    },
    "companies": [
        {
            "company": "Olivander's (Magic Wand Inc.)",
            "title": "Senior Data Wizard / Spell Engineer",
            "start_date": "November 1486",
            "end_date": "May 1693",
            "location": "Salem, MA",
            "career": "Enchanter"
        },
        {
            "company": "Magical Bean Trading Co. (Beanstalk & Sons)",
            "title": "Potions Stirrer / Enchanter",
            "start_date": "September 1258",
            "end_date": "November 1486",
            "location": "Munchen, Germany",
            "career": "Enchanter"
        },
        {
            "company": "Stieg & Son's Lumber Company",
            "title": "Lumberjack",
            "start_date": "September 1249",
            "end_date": "September 1254",
            "location": "Munchen, Germany",
            "career": "Lumberjack"
        }
    ],
    "achievements": [
        {
            "company": "Olivander's (Magic Wand Inc.)",
            "content": "Flagged, authored and implemented solution to deduplicate 600M magical creature contacts, reducing contact duplication rates by 50%, significantly improving experience for millions of spell-sellers",
            "highlights": [
                "deduplicate 600M magical creature contacts",
                "reducing contact duplication rates by 50%",
                "for millions of spell-sellers"
            ],
            "key_achievement": "Processed and deduplicated 600+ million mystical contact profiles to clean up enchanted directories"
        },
        {
            "company": "Olivander's (Magic Wand Inc.)",
            "content": "Provided ROI analysis and recommendations for the crystal ball collections feature enabling hundreds of millions of additional scrying addresses resulting in millions of gold coins in incremental marketing revenue for potion-sellers",
            "highlights": [
                "hundreds of millions of additional scrying addresses",
                "millions of gold coins in incremental marketing revenue"
            ]
        },
        {
            "company": "Olivander's (Magic Wand Inc.)",
            "content": "Engineered PII compliant ETL infrastructure resolving wizard identities between Spell App and Enchanted Rectangles datasets, unlocking billions of data points for 200+ data sorcerers and accelerating top down magical initiatives",
            "highlights": [
                "unlocking billions of data points for 200+ data sorcerers"
            ]
        },
        {
            "company": "Olivander's (Magic Wand Inc.)",
            "content": "Led data migration of billions of spell-casting events for dozens of data wizards, establishing protocols that improved cross-team collaboration and reduced data wizard overhead and compute time by 30%",
            "highlights": [
                "enterprise and realm wide",
                "data migration of billions of spell-casting events",
                "reduced data wizard overhead and compute time by 30%"
            ],
            "key_achievement": "Successfully implemented enterprise and realm wide solutions and processes supporting 200+ data sorcerers"
        },
        {
            "company": "Olivander's (Magic Wand Inc.)",
            "content": "Trained an XGBoost familiar to label spam scrolls achieving 90% precision on an extremely unbalanced dataset of ancient texts. The resulting magical guard rails and risk model improvements blocked thousands of cursed scrolls",
            "highlights": [
                "trained XGBoost familiar",
                "blocked thousands of cursed scrolls",
                "90% precision on ancient texts"
            ],
            "key_achievement": "Successfully deployed anti-curse protection for magical messaging system"
        },
        {
            "company": "Magical Bean Trading Co. (Beanstalk & Sons)",
            "content": "Improved healthcare potion forecasting accuracy by 15% through advanced crystal engineering and novel elixir function development, directly contributing to a deal with a leading dragon insurance provider",
            "highlights": [
                "Improved healthcare potion forecasting accuracy by 15%"
            ],
            "key_achievement": "Improved healing prediction accuracy by 15% using advanced crystal ball techniques"
        },
        {
            "company": "Magical Bean Trading Co. (Beanstalk & Sons)",
            "content": "Developed and deployed deep learning familiars using TensorFlow for time-series prediction of patient magical ailment costs, processing millions of electronic health runes with complex temporal spell dependencies",
            "highlights": [
                "deployed deep learning familiars",
                "processing millions of electronic health runes"
            ]
        },
        {
            "company": "Magical Bean Trading Co. (Beanstalk & Sons)",
            "content": "Modernized Spark cauldron ETL to process millions of FHIR-compliant patient runes from large, distributed crystal datasets, achieving 50% improvement in processing speed and mana efficiency",
            "highlights": [
                "achieving 50% improvement in processing speed and mana efficiency"
            ]
        },
        {
            "company": "Magical Bean Trading Co. (Beanstalk & Sons)",
            "content": "Created familiar experimentation framework using a Python spell, which accelerated development cycles and provided measurable performance metrics for the High Council"
        },
        {
            "company": "Stieg & Son's Lumber Company",
            "content": "Discovered, planted and mentored magical beanstalk. As a result, we were able to steal 500+ pounds giant's gold and a golden goose for continue ROI",
            "highlights": [
                "managing the daily throughput of 500,000+ pounds of enchanted coffee beans"
            ]
        },
        {
            "company": "Stieg & Son's Lumber Company",
            "content": "Lumber acquisition and stock management, ensuring that local farmers and builders have sufficient supply to house and feed the settlement"
        }
    ],
    "education": [
        {
            "degree": "Certificate in Magical Learning Operations (MLOPS)",
            "institution": "Magic Max's School for Dummies",
            "year": "2025",
            "details": null,
            "location": null
        },
        {
            "degree": "Mage of Theoretical Dark Arts",
            "institution": "Durmstrung Institute",
            "year": "1254-1258",
            "details": "Achieved five Outstanding grades in N.E.W.T. exams. Achieving Auror qualifications",
            "location": "Munchen, Germany"
        }
    ],
    "hobbies": [
        {
            "title": "WLAA Volunteer (Wizards with Learning Assistance Association)",
            "summary": "Attending, supporting and volunteering for the local chapter of the Wizards with Learning Assistance Association, helping fellow spellcasters with dyslexic incantations"
        },
        {
            "title": "Retired Beater",
            "summary": "Retired Quidditch beater trying to keep sharp on rainbow slopes in Unicorn Valley and Dragon Ridge"
        },
        {
            "title": "'Mystical Vibe' Coding",
            "summary": "Developed custom spells to track potions ingredient usage, track dragon migration patterns, and divine stock investments using a crystal ball"
        }
    ],
    "skills": {
        "technical": {
            "programming": [
                "Python (Parseltongue variant)",
                "Runes",
                "SQL (Spell Query Language)",
                "Spark (Lightning Magic)"
            ],
            "frameworks": [
                "ETL/ELT (Extract Transform Load/Enchant Transform Levitate)"
            ],
            "machinelearning": [
                "Scikit-Learn (Science Kit for Learning Magic)",
                "Neural Networks (Synaptic Spell Webs)",
                "Deep Learning (Profound Magical Understanding)",
                "LLMs (Large Language Familiars)",
                "NLP (Natural Language Processing Potions)"
            ],
            "databases": [
                "Data Warehousing (Magical Storage Facilities)",
                "Distributed Computing (Multi-Dimensional Processing)"
            ],
            "cloud": [
                "GCP (Google Cloud Platform / Giant Cloud Palace)"
            ],
            "tools": [
                "Airflow (Wind Magic Orchestration)",